{
  "contract_version": "worker.task.v1",
  "job_id": "job_fixture_simulation",
  "job_type": "SIMULATION",
  "run_id": "run_fixture_simulation",
  "attempt_id": "attempt_fixture_1",
  "lease_token": "fixture-secret-not-for-logs",
  "dataset": {
    "dataset_id": "ds_fixture_valid",
    "relative_path": "datasets/ds_fixture_valid/source.csv",
    "sha256": "0123456789abcdef0123456789abcdef0123456789abcdef0123456789abcdef",
    "timezone": "Asia/Shanghai",
    "columns": ["Time_base", "dzdl_1", "dzdl_2", "dzdl_3", "dzdl_4", "zl", "sd"]
  },
  "run_mode": "REFERENCE",
  "parameter_snapshot": {"version_id": "reference-v1", "sha256": "abcdef0123456789abcdef0123456789abcdef0123456789abcdef0123456789", "shared_parameters": {}, "agents": [{"agent": 1, "segment": "EARLY", "parameters": {}}, {"agent": 2, "segment": "MIDDLE", "parameters": {}}, {"agent": 3, "segment": "LATE", "parameters": {}}], "fixed_items": {"agent_count": 3, "feature_dimension_formula": "4*nLag+32", "leave_one_out_global_model": true, "predict_then_update": true}},
  "mapping_snapshot": {"version_id": "identity-v1", "mapping_type": "identity", "parameters": {}, "result_unit": "A", "sha256": "abcdef0123456789abcdef0123456789abcdef0123456789abcdef0123456789"},
  "field_standard_snapshot": {"configuration_version": "platform-config.v1", "sha256": "43064ad17fb882bb086f655e2f6bd4a85cce5ec6244b0586907c3c49f9e79ca4", "zl": {"unit_symbol": null, "validation_enabled": false}, "sd": {"unit_symbol": null, "validation_enabled": false}, "sampling": {"expected_period_ms": null, "tolerance_ms": null}},
  "runtime": {"algorithm_version": "contract-test-only", "worker_version": "contract-test-only", "image_digest": "sha256:b860f061c803bc73ec8ae0b84bf0db309d10c8750f17f013f17ad0655f531642", "numeric_runtime": "contract-test-only", "master_seed": 2026, "random_streams": {"generator": "MT19937_TWISTER_COMPAT", "seed_mapping_version": "reference-anchor-v1", "base_center_seed_by_agent": {"1": 2027, "2": 2028, "3": 2029}, "transition_center_seed_by_agent": {"1": 2047, "2": 2048, "3": 2049}, "boundary_seed_by_agent": {"1": 2067, "2": 2068, "3": 2069}, "public_anchor_seed": 2126}},
  "output": {"relative_tmp_directory": "runs/run_fixture_simulation/tmp/attempt_fixture_1", "required_artifact_schema": "artifact.manifest.v1"},
  "limits": {"memory_bytes": 10737418240, "cancel_check_target_ms": 5000}
}
